{
  "contract_version": "1.0.0",
  "producer": "ado-gateway",
  "consumer": "openspec-gateway",
  "artifact_type": "ado-normalized",
  "mode": "work-item",
  "source": {
    "platform": "azure-devops",
    "organization": "example-org",
    "project": "example-project",
    "repository_id": "",
    "pull_request_id": null,
    "work_item_id": 1234,
    "read_only": true
  },
  "normalization": {
    "status": "pass",
    "missing_fields": [],
    "warnings": [],
    "html_stripped": true,
    "secret_redactions_applied": true
  },
  "work_item": {
    "id": 1234,
    "type": "User Story",
    "title": "Checkout supports discount codes",
    "description": "Add discount code support to checkout.",
    "acceptance_criteria": "Given a valid code, when checkout is submitted, then the discount is applied.",
    "repro_steps": "",
    "system_info": "",
    "tags": "checkout;discount",
    "state": "New"
  },
  "pr_comments": []
}
